provinsi,kab_kota,kecamatan,nama_sekolah,url
Prov. Papua,Kab. Nabire,Kec. Uwapa,SD Negeri Inpres Argomulyo,http://dapo.dikdasmen.kemdikbud.go.id/sekolah/860D1A58D4AB046A1F81
Prov. Papua,Kab. Nabire,Kec. Uwapa,SD Negeri Inpres Gamei Jaya,http://dapo.dikdasmen.kemdikbud.go.id/sekolah/4F669F41B9BF05CB5344
Prov. Papua,Kab. Nabire,Kec. Uwapa,SD Negeri Inpres I/F Marga Jaya,http://dapo.dikdasmen.kemdikbud.go.id/sekolah/FC3E1F2C68E29D88F975
Prov. Papua,Kab. Nabire,Kec. Uwapa,SD Negeri Inpres Topo,http://dapo.dikdasmen.kemdikbud.go.id/sekolah/74431CB254397F9F53DD
Prov. Papua,Kab. Nabire,Kec. Uwapa,SD Negeri Inpres Topo Jaya III/F,http://dapo.dikdasmen.kemdikbud.go.id/sekolah/9B9358201FB91BC66F06
Prov. Papua,Kab. Nabire,Kec. Uwapa,SD Negeri Inpres Urumusu,http://dapo.dikdasmen.kemdikbud.go.id/sekolah/E697210FB2E0DF691058
